ID,Title,Authors,Abstract,Keywords,Journal,Publication_Date,Year,DOI,URL,Source,Country,Language
https://openalex.org/W4285004946,Plant Disease Detection Using Deep Convolutional Neural Network,J. Arun Pandian;V. Dhilip Kumar;Oana Geman;Mihaela Hnatiuc;Muhammad Arif;K. Kanchanadevi,Abstract available,,Applied Sciences,,2022,10.3390/app12146982,https://www.mdpi.com/2076-3417/12/14/6982/pdf?version=1657532825,OPENALEX,,
https://openalex.org/W4296225832,Deep convolutional generative adversarial network with semi-supervised learning enabled physics elucidation for extended gear fault diagnosis under data limitations,Kai Zhou;Edward Diehl;Jiong Tang,,,Mechanical Systems and Signal Processing,,2022,10.1016/j.ymssp.2022.109772,https://www.sciencedirect.com/science/article/am/pii/S0888327022008408,OPENALEX,,
https://openalex.org/W4378637195,Adaptive variational autoencoding generative adversarial networks for rolling bearing fault diagnosis,Xin Wang;Hongkai Jiang;Zhenghong Wu;Qiao Yang,,,Advanced Engineering Informatics,,2023,10.1016/j.aei.2023.102027,null,OPENALEX,,
https://openalex.org/W4200016808,Fault Detection in Gears Using Fault Samples Enlarged by a Combination of Numerical Simulation and a Generative Adversarial Network,Yun Gao;Xiaoyang Liu;Jiawei Xiang,Abstract available,,IEEE/ASME Transactions on Mechatronics,,2021,10.1109/tmech.2021.3132459,null,OPENALEX,,
https://openalex.org/W4285264320,DNN-Based Indoor Localization Under Limited Dataset Using GANs and Semi-Supervised Learning,Wafa Njima;Ahmad Bazzi;Marwa Chafii,Abstract available,,IEEE Access,,2022,10.1109/access.2022.3187837,https://ieeexplore.ieee.org/ielx7/6287639/6514899/09812625.pdf,OPENALEX,,
https://openalex.org/W3193083951,"GAN computers generate arts? A survey on visual arts, music, and literary text generation using generative adversarial network",Sakib Shahriar,,,Displays,,2022,10.1016/j.displa.2022.102237,https://arxiv.org/pdf/2108.03857,OPENALEX,,
https://openalex.org/W3014151993,Detection of Coronavirus (COVID-19) Associated Pneumonia Based on Generative Adversarial Networks and a Fine-Tuned Deep Transfer Learning Model Using Chest X-ray Dataset,Nour Eldeen M. Khalifa;Mohamed Hamed N. Taha;Aboul Ella Hassanien;Sally M. Elghamrawy,,,Lecture notes on data engineering and communications technologies,,2022,10.1007/978-3-031-20601-6_22,https://arxiv.org/pdf/2004.01184,OPENALEX,,
https://openalex.org/W3215399882,Morphological Feature Visualization of Alzheimer’s Disease via Multidirectional Perception GAN,Yu Wen;Baiying Lei;Shuqiang Wang;Yong Liu;Zhiguang Feng;Yong Hu;Yanyan Shen;Michael K. Ng,Abstract available,,IEEE Transactions on Neural Networks and Learning Systems,,2022,10.1109/tnnls.2021.3118369,http://arxiv.org/pdf/2111.12886,OPENALEX,,
https://openalex.org/W4292117317,Generative Adversarial Networks in the built environment: A comprehensive review of the application of GANs across data types and scales,Abraham Noah Wu;Rudi Stouffs;Filip Biljecki,,,Building and Environment,,2022,10.1016/j.buildenv.2022.109477,null,OPENALEX,,
https://openalex.org/W4313452645,Automatic classification of asphalt pavement cracks using a novel integrated generative adversarial networks and improved VGG model,Yun Que;Yi Dai;Xue Ji;Anthony Kwan Leung;Zheng Chen;Zhenliang Jiang;Yunchao Tang,,,Engineering Structures,,2023,10.1016/j.engstruct.2022.115406,null,OPENALEX,,
https://openalex.org/W3055194044,Generative Adversarial Networks for Spatio-temporal Data: A Survey,Nan Gao;Hao Xue;Wei Shao;Sichen Zhao;Kyle K. Qin;Arian Prabowo;Mohammad Saiedur Rahaman;Flora D. Salim,Abstract available,,ACM Transactions on Intelligent Systems and Technology,,2022,10.1145/3474838,https://arxiv.org/pdf/2008.08903,OPENALEX,,
https://openalex.org/W4221145616,Depth-Aware Generative Adversarial Network for Talking Head Video Generation,Fa-Ting Hong;Longhao Zhang;Li Shen;Dan Xu,Abstract available,,,,2022,10.1109/cvpr52688.2022.00339,https://repository.hkust.edu.hk/ir/bitstream/1783.1-119356/1/119356-1.pdf,OPENALEX,,
https://openalex.org/W4213366994,CNN-RNN and Data Augmentation Using Deep Convolutional Generative Adversarial Network for Environmental Sound Classification,Behnaz Bahmei;Elina Birmingham;Siamak Arzanpour,Abstract available,,IEEE Signal Processing Letters,,2022,10.1109/lsp.2022.3150258,null,OPENALEX,,
https://openalex.org/W4315607822,Fine-tuning transfer learning based on DCGAN integrated with self-attention and spectral normalization for bearing fault diagnosis,Hongyu Zhong;Samson S. Yu;Hieu Trinh;Yong Lv;Rui Yuan;Yanan Wang,,,Measurement,,2023,10.1016/j.measurement.2022.112421,null,OPENALEX,,
https://openalex.org/W4213397551,TTS-GAN: A Transformer-Based Time-Series Generative Adversarial Network,Xiaomin Li;Vangelis Metsis;Huangyingrui Wang;Anne H. H. Ngu,,,Lecture notes in computer science,,2022,10.1007/978-3-031-09342-5_13,https://arxiv.org/pdf/2202.02691,OPENALEX,,
https://openalex.org/W4312052673,AT-GAN: A generative adversarial network with attention and transition for infrared and visible image fusion,Yujing Rao;Dan Wu;Mina Han;Ting Wang;Yang Yang;Tao Leí;Chengjiang Zhou;Haicheng Bai;Lin Xing,,,Information Fusion,,2022,10.1016/j.inffus.2022.12.007,null,OPENALEX,,
https://openalex.org/W4385272245,A multimodal comparison of latent denoising diffusion probabilistic models and generative adversarial networks for medical image synthesis,Gustav Müller?Franzes;Jan Niehues;Firas Khader;Soroosh Tayebi Arasteh;Christoph Haarburger;Christiane Kühl;Tianci Wang;Tianyu Han;Teresa Nolte;Sven Nebelung;Jakob Nikolas Kather;Daniel Truhn,Abstract available,,Scientific Reports,,2023,10.1038/s41598-023-39278-0,https://www.nature.com/articles/s41598-023-39278-0.pdf,OPENALEX,,
https://openalex.org/W4390937897,Ten years of generative adversarial nets (GANs): a survey of the state-of-the-art,Tanujit Chakraborty;Ujjwal Reddy K S;Shraddha M. Naik;Madhurima Panja;Bayapureddy Manvitha,Abstract available,,Machine Learning Science and Technology,,2024,10.1088/2632-2153/ad1f77,https://iopscience.iop.org/article/10.1088/2632-2153/ad1f77/pdf,OPENALEX,,
https://openalex.org/W4366979320,Building layout generation using site-embedded GAN model,Feifeng Jiang;Jun Ma;Chris Webster;Xiao Li;Vincent J.L. Gan,,,Automation in Construction,,2023,10.1016/j.autcon.2023.104888,null,OPENALEX,,
https://openalex.org/W4323022407,An Improved Dense CNN Architecture for Deepfake Image Detection,Y. G. Patel;Sudeep Tanwar;Pronaya Bhattacharya;Rajesh Gupta;Turki Alsuwian;Innocent E. Davidson;Thokozile Mazibuko,Abstract available,,IEEE Access,,2023,10.1109/access.2023.3251417,https://ieeexplore.ieee.org/ielx7/6287639/6514899/10057390.pdf,OPENALEX,,
https://openalex.org/W4313491188,A deeper generative adversarial network for grooved cement concrete pavement crack detection,Jingtao Zhong;Ju Huyan;Weiguang Zhang;Hanglin Cheng;Jing Zhang;Tong Zheng;Xi Jiang;Baoshan Huang,,,Engineering Applications of Artificial Intelligence,,2023,10.1016/j.engappai.2022.105808,null,OPENALEX,,
https://openalex.org/W4318570524,A GAN-Based Model of Deepfake Detection in Social Media,Preeti Preeti;Manoj Kumar;Hitesh Kumar Sharma,Abstract available,,Procedia Computer Science,,2023,10.1016/j.procs.2023.01.191,https://doi.org/10.1016/j.procs.2023.01.191,OPENALEX,,
https://openalex.org/W4391046504,Future of generative adversarial networks (GAN) for anomaly detection in network security: A review,Willone Lim;Kelvin S. C. Yong;Lau Bee Theng;Choon Lin Tan,Abstract available,,Computers & Security,,2024,10.1016/j.cose.2024.103733,https://doi.org/10.1016/j.cose.2024.103733,OPENALEX,,
https://openalex.org/W4392005745,Deep leaning in food safety and authenticity detection: An integrative review and future prospects,Yan Wang;Hui?Wen Gu;Xiaoli Yin;Tao Geng;Wanjun Long;Haiyan Fu;Yuanbin She,,,Trends in Food Science & Technology,,2024,10.1016/j.tifs.2024.104396,null,OPENALEX,,
https://openalex.org/W4402834117,A trackable multi-domain collaborative generative adversarial network for rotating machinery fault diagnosis,Xin Wang;Hongkai Jiang;Mingzhe Mu;Yutong Dong,,,Mechanical Systems and Signal Processing,,2024,10.1016/j.ymssp.2024.111950,null,OPENALEX,,
https://openalex.org/W4395462076,Revolutionizing personalized medicine with generative AI: a systematic review,Isaias Ghebrehiwet;Nazar Zaki;Rafat Damseh;Mohd Saberi Mohamad,Abstract available,,Artificial Intelligence Review,,2024,10.1007/s10462-024-10768-5,https://doi.org/10.1007/s10462-024-10768-5,OPENALEX,,
https://openalex.org/W4401384485,GAN based augmentation using a hybrid loss function for dermoscopy images,Evgin Göçeri,Abstract available,,Artificial Intelligence Review,,2024,10.1007/s10462-024-10897-x,https://doi.org/10.1007/s10462-024-10897-x,OPENALEX,,
https://openalex.org/W4392173886,"Generative Adversarial Networks (GANs) in Medical Imaging: Advancements, Applications, and Challenges",Showrov Islam;M Aziz;Hadiur Rahman Nabil;Jamin Rahman Jim;M. F. Mridha;Md. Mohsin Kabir;Nobuyoshi Asai;Jungpil Shin,Abstract available,,IEEE Access,,2024,10.1109/access.2024.3370848,https://ieeexplore.ieee.org/ielx7/6287639/6514899/10445413.pdf,OPENALEX,,
https://openalex.org/W4403042146,Retinal fundus image super-resolution based on generative adversarial network guided with vascular structure prior,Yanfei Jia;Guangda Chen;Haotian Chi,,,Scientific Reports,,2024,10.1038/s41598-024-74186-x,https://doi.org/10.1038/s41598-024-74186-x,OPENALEX,,
https://openalex.org/W4393153538,Enhancing Job Recommendation through LLM-Based Generative Adversarial Networks,Yingpeng Du;Di Luo;Rui Yan;Xiaopei Wang;Hongzhi Liu;Hengshu Zhu;Yang Song;Jie Zhang,Abstract available,,,,2024,10.1609/aaai.v38i8.28678,https://ojs.aaai.org/index.php/AAAI/article/download/28678/29317,OPENALEX,,
https://openalex.org/W4402077967,A new chiller fault diagnosis method under the imbalanced data environment via combining an improved generative adversarial network with an enhanced deep extreme learning machine,Wenxin Yang;Hanyuan Zhang;Jit Bing Lim;Yuyu Zhang;Huanhuan Meng,,,Engineering Applications of Artificial Intelligence,,2024,10.1016/j.engappai.2024.109218,null,OPENALEX,,
https://openalex.org/W4393195412,"Generative adversarial networks (GANs): Introduction, Taxonomy, Variants, Limitations, and Applications",Preeti Sharma;Manoj Kumar;Hitesh Kumar Sharma;Soly Mathew Biju,Abstract available,,Multimedia Tools and Applications,,2024,10.1007/s11042-024-18767-y,https://link.springer.com/content/pdf/10.1007/s11042-024-18767-y.pdf,OPENALEX,,
https://openalex.org/W4393346493,TRA-ACGAN: A motor bearing fault diagnosis model based on an auxiliary classifier generative adversarial network and transformer network,Zhaoyang Fu;Zheng Liu;Shuangrui PING;Weilin Li;Jinglin Liu,,,ISA Transactions,,2024,10.1016/j.isatra.2024.03.033,null,OPENALEX,,
https://openalex.org/W4398787803,Transformer-based Generative Adversarial Networks in Computer Vision: A Comprehensive Survey,Shiv Ram Dubey;Satish Kumar Singh,Abstract available,,IEEE Transactions on Artificial Intelligence,,2024,10.1109/tai.2024.3404910,https://arxiv.org/pdf/2302.08641,OPENALEX,,
https://openalex.org/W4395475051,A CNN-BiLSTM-Attention approach for EHA degradation prediction based on time-series generative adversarial network,Zhonghai Ma;Yiwen Sun;Hui Ji;Suolan Li;Songlin Nie;Fanglong Yin,,,Mechanical Systems and Signal Processing,,2024,10.1016/j.ymssp.2024.111443,null,OPENALEX,,
https://openalex.org/W4401807480,Novel imbalanced fault diagnosis method based on generative adversarial networks with balancing serial CNN and Transformer (BCTGAN),Hualin Chen;Jianan Wei;Haisong Huang;Long Wen;Yage Yuan;Jinxing Wu,,,Expert Systems with Applications,,2024,10.1016/j.eswa.2024.125171,null,OPENALEX,,
https://openalex.org/W4399360603,Effective plant disease diagnosis using Vision Transformer trained with leafy-generative adversarial network-generated images,Aadarsh Kumar Singh;A. D. P. Rao;Pratik Chattopadhyay;Rahul Maurya;Lokesh Singh,,,Expert Systems with Applications,,2024,10.1016/j.eswa.2024.124387,null,OPENALEX,,
https://openalex.org/W4406874451,Novel Domain-Adaptive Wasserstein Generative Adversarial Networks for Early Bearing Fault Diagnosis under Various Conditions,Z. K. Hei;Weifang Sun;Haiyang Yang;Meipeng Zhong;Yanling Li;Anil Kumar;Jiawei Xiang;Yuqing Zhou,,,Reliability Engineering & System Safety,,2025,10.1016/j.ress.2025.110847,null,OPENALEX,,
https://openalex.org/W4406070258,"A systematic review of generative adversarial networks for traffic state prediction: Overview, taxonomy, and future prospects",Ying Li;Fan Bai;Cheng Lyu;Xiaobo Qu;Yang Liu,,,Information Fusion,,2025,10.1016/j.inffus.2024.102915,null,OPENALEX,,
https://openalex.org/W4408069613,Fault diagnosis method for imbalanced data based on adaptive diffusion models and generative adversarial networks,Xueyi Li;Xudong Wu;Tianyang Wang;Yining Xie;Fulei Chu,,,Engineering Applications of Artificial Intelligence,,2025,10.1016/j.engappai.2025.110410,null,OPENALEX,,
https://openalex.org/W4406863313,Leveraging Generative Adversarial Networks for Data Augmentation to Improve Fault Detection in Wind Turbines with Imbalanced Data,Subhajit Chatterjee;Yung-Cheol Byun,,,Results in Engineering,,2025,10.1016/j.rineng.2025.103991,https://doi.org/10.1016/j.rineng.2025.103991,OPENALEX,,
https://openalex.org/W4409533296,A Bayesian-physical informed conditional tabular generative adversarial network framework for low-carbon concrete data augmentation and hyperparameter optimization,Shiqi Wang;Peng Xia;Fuyuan Gong;Yuxi Zhao;Peng Lin,,,Engineering Applications of Artificial Intelligence,,2025,10.1016/j.engappai.2025.110811,null,OPENALEX,,
https://openalex.org/W4406325546,DCGAN-Based Feature Augmentation: A Novel Approach for Efficient Mineralization Prediction Through Data Generation,Soran Qaderi;Abbas Maghsoudi;Amin Beiranvand Pour;Abdorrahman Rajabi;Mahyar Yousefi,Abstract available,,Minerals,,2025,10.3390/min15010071,https://doi.org/10.3390/min15010071,OPENALEX,,
https://openalex.org/W4406934712,Remote sensing image dehazing using a wavelet-based generative adversarial networks,Guangda Chen;Yanfei Jia;Yanjiang Yin;Shujun Fu;Dejun Liu;Tenghao Wang,Abstract available,,Scientific Reports,,2025,10.1038/s41598-025-87240-z,https://doi.org/10.1038/s41598-025-87240-z,OPENALEX,,
https://openalex.org/W4410456459,PCS: Property-composition-structure chain in Mg-Nd alloys through integrating sigmoid fitting and conditional generative adversarial network modeling,Qin Xu;Qinghang Wang;Xinbing Zhao;Shouxin Xia;Li Wang;Yuhui Zhang;Chao He;D.L. Chen;Bin Jiang,,,Scripta Materialia,,2025,10.1016/j.scriptamat.2025.116762,null,OPENALEX,,
https://openalex.org/W4405964036,Predicting Penetration Depth in Ultra-High-Performance Concrete Targets under Ballistic Impact: An Interpretable Machine Learning Approach Augmented by Deep Generative Adversarial Network,Majid Khan;Muhammad Faisal Javed;Nashwan Adnan Othman;Sardar Kashif Ur Rehman;Furqan Ahmad,,,Results in Engineering,,2025,10.1016/j.rineng.2024.103909,https://doi.org/10.1016/j.rineng.2024.103909,OPENALEX,,
https://openalex.org/W4409086284,Well log data generation and imputation using sequence based generative adversarial networks,Abdulrahman Al?Fakih;Ardiansyah Koeshidayatullah;Tapan Mukerji;Sadam Al-Azani;SanLinn I. Kaka,Abstract available,,Scientific Reports,,2025,10.1038/s41598-025-95709-0,https://doi.org/10.1038/s41598-025-95709-0,OPENALEX,,
https://openalex.org/W4410350089,Randomly generating realistic calcareous sand for directional seepage simulation using deep convolutional generative adversarial networks,Dou Chen;Wei Zhang;Chenghao Li;Linjian Ma;Xiaoqing Shi;Haiyang Li;Hong?Hu Zhu,,,Journal of Rock Mechanics and Geotechnical Engineering,,2025,10.1016/j.jrmge.2025.01.055,https://doi.org/10.1016/j.jrmge.2025.01.055,OPENALEX,,
https://openalex.org/W4406325278,A new paradigm based on Wasserstein Generative Adversarial Network and time-series graph for integrated energy system forecasting,Zhirui Tian;Mei Gai,,,Energy Conversion and Management,,2025,10.1016/j.enconman.2025.119484,null,OPENALEX,,
https://openalex.org/W2801495938,Non-stationary texture synthesis by adversarial expansion,Yang Zhou;Zhen Zhu;Xiang Bai;Dani Lischinski;Daniel Cohen?Or;Hui Huang,Abstract available,,ACM Transactions on Graphics,,2018,10.1145/3197517.3201285,https://arxiv.org/pdf/1805.04487,OPENALEX,,
https://openalex.org/W2804918468,Auto-painter: Cartoon image generation from sketch by using conditional Wasserstein generative adversarial networks,Yifan Liu;Zengchang Qin;Tao Wan;Zhenbo Luo,,,Neurocomputing,,2018,10.1016/j.neucom.2018.05.045,null,OPENALEX,,
https://openalex.org/W2806695658,Deformable medical image registration using generative adversarial networks,Dwarikanath Mahapatra;Bhavna Antony;Suman Sedai;Rahil Garnavi,Abstract available,,,,2018,10.1109/isbi.2018.8363845,null,OPENALEX,,
https://openalex.org/W3123551284,Training?Image Based Geostatistical Inversion Using a Spatial Generative Adversarial Neural Network,Eric Laloy;Romain Hérault;Diederik Jacques;Niklas Linde,Abstract available,,Water Resources Research,,2018,10.1002/2017wr022148,https://hal.science/hal-02094971/document,OPENALEX,,
https://openalex.org/W2806276686,Data synthesis based on generative adversarial networks,Noseong Park;Mahmoud Mohammadi;Kshitij Gorde;Sushil Jajodia;Hong?Kyu Park;Youngmin Kim,Abstract available,,,,2018,10.14778/3231751.3231757,http://arxiv.org/pdf/1806.03384,OPENALEX,,
https://openalex.org/W2887579808,Denoising of 3D magnetic resonance images using a residual encoder–decoder Wasserstein generative adversarial network,Maosong Ran;Jinrong Hu;Yang Chen;Hu Chen;Huaiqiang Sun;Jiliu Zhou;Yi Zhang,,,Medical Image Analysis,,2019,10.1016/j.media.2019.05.001,http://arxiv.org/pdf/1808.03941,OPENALEX,,
https://openalex.org/W2790214987,An Introduction to Image Synthesis with Generative Adversarial Nets,He Huang;Philip S. Yu;Changhu Wang,Abstract available,,arXiv (Cornell University),,2018,10.48550/arxiv.1803.04469,https://arxiv.org/abs/1803.04469,OPENALEX,,
https://openalex.org/W2964323748,High-Quality Facial Photo-Sketch Synthesis Using Multi-Adversarial Networks,Lidan Wang;Vishwanath A. Sindagi;Vishal M. Patel,Abstract available,,,,2018,10.1109/fg.2018.00022,http://arxiv.org/pdf/1710.10182,OPENALEX,,
https://openalex.org/W2953868242,Semi-supervised defect classification of steel surface based on multi-training and generative adversarial network,Yu He;Kechen Song;Hongwen Dong;Yunhui Yan,,,Optics and Lasers in Engineering,,2019,10.1016/j.optlaseng.2019.06.020,https://www.sciencedirect.com/science/article/am/pii/S0143816619306499,OPENALEX,,
https://openalex.org/W2901339722,A Conditional Generative Adversarial Network to Fuse Sar And Multispectral Optical Data For Cloud Removal From Sentinel-2 Images,Claas Grohnfeldt;Michael Schmitt;Xiao Xiang Zhu,Abstract available,,,,2018,10.1109/igarss.2018.8519215,https://elib.dlr.de/120080/1/cg_ms_xz_igarss18_fullPaper_Schmitt.pdf,OPENALEX,,
https://openalex.org/W3034954643,Local Class-Specific and Global Image-Level Generative Adversarial Networks for Semantic-Guided Scene Generation,Hao Tang;Dan Xu;Yan Yan;Philip H. S. Torr;Nicu Sebe,Abstract available,,,,2020,10.1109/cvpr42600.2020.00789,https://iris.unitn.it/bitstream/11572/284530/1/Tang_Local_Class-Specific_and_Global_Image-Level_Generative_Adversarial_Networks_for_Semantic-Guided_CVPR_2020_paper.pdf,OPENALEX,,
https://openalex.org/W2937975340,Data Augmentation Using GANs,Fabio Henrique Kiyoiti dos Santos Tanaka;Claus Aranha,Abstract available,,arXiv (Cornell University),,2019,10.48550/arxiv.1904.09135,https://arxiv.org/abs/1904.09135,OPENALEX,,
https://openalex.org/W2963352069,RenderGAN: Generating Realistic Labeled Data,Leon Sixt;Benjamin Wild;Tim Landgraf,Abstract available,,Frontiers in Robotics and AI,,2018,10.3389/frobt.2018.00066,https://www.frontiersin.org/articles/10.3389/frobt.2018.00066/pdf,OPENALEX,,
https://openalex.org/W2978074392,Attention-Guided Generative Adversarial Networks for Unsupervised Image-to-Image Translation,Hao Tang;Dan Xu;Nicu Sebe;Yan Yan,Abstract available,,,,2019,10.1109/ijcnn.2019.8851881,https://iris.unitn.it/bitstream/11572/250761/1/1903.12296.pdf,OPENALEX,,
https://openalex.org/W2963991565,CR-GAN: Learning Complete Representations for Multi-view Generation,Yu Tian;Xi Peng;L. Zhao;Shaoting Zhang;Dimitris Metaxas,Abstract available,,,,2018,10.24963/ijcai.2018/131,https://doi.org/10.24963/ijcai.2018/131,OPENALEX,,
https://openalex.org/W2892153332,Diversity-Promoting GAN: A Cross-Entropy Based Generative Adversarial Network for Diversified Text Generation,Jingjing Xu;Xuancheng Ren;Junyang Lin;Xu Sun,Abstract available,,,,2018,10.18653/v1/d18-1428,https://www.aclweb.org/anthology/D18-1428.pdf,OPENALEX,,
https://openalex.org/W2963516695,Geometry Guided Adversarial Facial Expression Synthesis,Lingxiao Song;Zhihe Lu;Ran He;Zhenan Sun;Tieniu Tan,Abstract available,,,,2018,10.1145/3240508.3240612,https://arxiv.org/pdf/1712.03474,OPENALEX,,
https://openalex.org/W2947934595,A review of generative adversarial networks and its application in cybersecurity,Chika Yinka-Banjo;Ogban-Asuquo Ugot,,,Artificial Intelligence Review,,2019,10.1007/s10462-019-09717-4,null,OPENALEX,,
https://openalex.org/W3035596626,Prior-Guided Image Reconstruction for Accelerated Multi-Contrast MRI via Generative Adversarial Networks,Salman Ul Hassan Dar;Mahmut Yurt;Mo Shahdloo;M. Emrullah Ildiz;Berk T?naz;Tolga Çukur,Abstract available,,IEEE Journal of Selected Topics in Signal Processing,,2020,10.1109/jstsp.2020.3001737,https://ora.ox.ac.uk/objects/uuid:fed6252a-7c74-491d-bbf3-7df1f0c7400d/files/sn870zq95s,OPENALEX,,
https://openalex.org/W2935787471,MRI-only brain radiotherapy: Assessing the dosimetric accuracy of synthetic CT images generated using a deep learning approach,Samaneh Kazemifar;Sarah McGuire;Robert Timmerman;Zabi Wardak;Dan Nguyen;Yang Park;Steve Jiang;Amir Owrangi,,,Radiotherapy and Oncology,,2019,10.1016/j.radonc.2019.03.026,https://arxiv.org/pdf/1904.05789,OPENALEX,,
https://openalex.org/W2974031746,A Review: Generative Adversarial Networks,Liang Gonog;Yimin Zhou,Abstract available,,,,2019,10.1109/iciea.2019.8833686,null,OPENALEX,,
https://openalex.org/W3082317190,Data augmentation for skin lesion using self-attention based progressive generative adversarial network,Ibrahim Abdelhalim;Mamdouh Mohamed;Yousef B. Mahdy,,,Expert Systems with Applications,,2020,10.1016/j.eswa.2020.113922,https://arxiv.org/pdf/1910.11960,OPENALEX,,
https://openalex.org/W2883938080,Pose Guided Human Video Generation,Ceyuan Yang;Zhe Wang;Xinge Zhu;Chen Huang;Jianping Shi;Dahua Lin,,,Lecture notes in computer science,,2018,10.1007/978-3-030-01249-6_13,http://arxiv.org/pdf/1807.11152,OPENALEX,,
https://openalex.org/W2922338032,Early Detection of Tomato Spotted Wilt Virus by Hyperspectral Imaging and Outlier Removal Auxiliary Classifier Generative Adversarial Nets (OR-AC-GAN),Dongyi Wang;Robert Vinson;Maxwell Holmes;Gary Seibel;Avital Bechar;Shimon Y. Nof;Yang Tao,Abstract available,,Scientific Reports,,2019,10.1038/s41598-019-40066-y,https://www.nature.com/articles/s41598-019-40066-y.pdf,OPENALEX,,
https://openalex.org/W2963100962,APE-GAN: Adversarial Perturbation Elimination with GAN,Guoqing Jin;Shiwei Shen;Dongming Zhang;Feng Dai;Yongdong Zhang,Abstract available,,,,2019,10.1109/icassp.2019.8683044,https://arxiv.org/pdf/1707.05474,OPENALEX,,
https://openalex.org/W3000672846,Cloud Removal with Fusion of High Resolution Optical and SAR Images Using Generative Adversarial Networks,Jianhao Gao;Qiangqiang Yuan;Jie Li;Zhang Hai;Xin Su,Abstract available,,Remote Sensing,,2020,10.3390/rs12010191,https://www.mdpi.com/2072-4292/12/1/191/pdf?version=1578218527,OPENALEX,,
https://openalex.org/W2944653015,Caps-TripleGAN: GAN-Assisted CapsNet for Hyperspectral Image Classification,Xue Wang;Kun Tan;Qian Du;Yu Chen;Peijun Du,Abstract available,,IEEE Transactions on Geoscience and Remote Sensing,,2019,10.1109/tgrs.2019.2912468,null,OPENALEX,,
https://openalex.org/W3094764353,Lightweight deep learning models for detecting COVID-19 from chest X-ray images,Stefanos Karakanis;Georgios Leontidis,,,Computers in Biology and Medicine,,2020,10.1016/j.compbiomed.2020.104181,https://doi.org/10.1016/j.compbiomed.2020.104181,OPENALEX,,
https://openalex.org/W2963165363,Learning Universal Adversarial Perturbations with Generative Models,Jamie Hayes;George Danezis,Abstract available,,,,2018,10.1109/spw.2018.00015,https://ieeexplore.ieee.org/ielx7/8420091/8424589/08424631.pdf,OPENALEX,,
https://openalex.org/W2914848199,Diversity-Sensitive Conditional Generative Adversarial Networks,Dingdong Yang;Seunghoon Hong;Yunseok Jang;Tianchen Zhao;Honglak Lee,Abstract available,,arXiv (Cornell University),,2019,10.48550/arxiv.1901.09024,https://arxiv.org/abs/1901.09024,OPENALEX,,
https://openalex.org/W2904022596,PGANs: Personalized Generative Adversarial Networks for ECG Synthesis to Improve Patient-Specific Deep ECG Classification,Tomer Golany;Kira Radinsky,Abstract available,,,,2019,10.1609/aaai.v33i01.3301557,https://aaai.org/ojs/index.php/AAAI/article/download/3830/3708,OPENALEX,,
https://openalex.org/W2963830453,Deep leaf?bootstrapping generative adversarial network for structural image data augmentation,Yuqing Gao;Boyuan Kong;Khalid M. Mosalam,Abstract available,,Computer-Aided Civil and Infrastructure Engineering,,2019,10.1111/mice.12458,null,OPENALEX,,
https://openalex.org/W2980688251,Fairness GAN: Generating datasets with fairness properties using a generative adversarial network,Prasanna Sattigeri;Samuel C. Hoffman;Vijil Chenthamarakshan;Kush R. Varshney,Abstract available,,IBM Journal of Research and Development,,2019,10.1147/jrd.2019.2945519,null,OPENALEX,,
