ID,Title,Authors,Abstract,Keywords,Journal,Publication_Date,Year,DOI,URL,Source,Country,Language
conf/hci/SohnGC24,Sustainable E-commerce Marketplace: Reshaping Consumer Purchasing Behavior Through Generative AI (Artificial Intelligence).,Jung Joo Sohn;Nickolas Guo;Youri Chung,,,HCI,,2024,10.1007/978-3-031-61315-9_18,https://doi.org/10.1007/978-3-031-61315-9_18,DBLP,,
conf/hhai/Peng24,Designing Expressive Interaction with Generative Artificial Intelligence.,,,,HHAI,,2024,10.3233/FAIA240215,https://doi.org/10.3233/FAIA240215,DBLP,,
conf/hicss/StrobelBMS24,Exploring Generative Artificial Intelligence: A Taxonomy and Types.,Gero Strobel;Leonardo Banh;Frederik Möller;Thorsten Schoormann,,,HICSS,,2024,,https://hdl.handle.net/10125/106930,DBLP,,
conf/icaie/FangL24,Application and Impact of Generative Artificial Intelligence Techniques in Education-Citespace-based visualization and analysis.,Wenjie Fang;Bin Luo,,,ICAIE,,2024,10.1145/3722237.3722258,https://doi.org/10.1145/3722237.3722258,DBLP,,
conf/icaie/LinZ24,Applications and Challenges of Generative Artificial Intelligence Enabling Critical Thinking Development in International Undergraduate Education.,Yan Lin;Lu Zhang,,,ICAIE,,2024,10.1145/3722237.3722399,https://doi.org/10.1145/3722237.3722399,DBLP,,
conf/icaie/XuJ24,Generative Artificial Intelligence Empowers the Research of Digital Textbooks in Vocational Education.,Yao Xu;Xiao Jian,,,ICAIE,,2024,10.1145/3722237.3722377,https://doi.org/10.1145/3722237.3722377,DBLP,,
conf/icaie/ZhouXTLZXL24,Trends and Challenges of Educational Application of Generative Artificial Intelligence.,Peijie Zhou;Haixia Xu;Yang Tan;Meilan Liu;Xia Zhou;Wenbo Xiong;Jianrong Li,,,ICAIE,,2024,10.1145/3722237.3722379,https://doi.org/10.1145/3722237.3722379,DBLP,,
conf/icaiic/Saha24,"Generative Artificial Intelligence for Industry: Opportunities, Challenges, and Impact.",,,,ICAIIC,,2024,10.1109/ICAIIC60209.2024.10463245,https://doi.org/10.1109/ICAIIC60209.2024.10463245,DBLP,,
conf/icbde/AlmadhoobSA24,QuizWiz: Integrating Generative Artificial Intelligence in an Online Study Tool.,Ali Husain Almadhoob;Akbar Sayed Kadhem Saleh;Fatema Akbar,,,ICBDE,,2024,10.1145/3704289.3704296,https://doi.org/10.1145/3704289.3704296,DBLP,,
conf/icbde/DuahLMJ24,Interdisciplinary Perspectives on Generative Artificial Intelligence Adoption in Higher Education: A Theoretical Framework Review.,James Ewert Duah;Xin Lu 0005;Paul McGivern;Yanguo Jing,,,ICBDE,,2024,10.1145/3704289.3704293,https://doi.org/10.1145/3704289.3704293,DBLP,,
conf/icce/AgboSN24,Competency-Based Assessment in the Era of Generative Artificial Intelligence: Perspectives of Selected STEM Educators.,Friday Joseph Agbo;Heather Kitada Smalley;Kathryn L. Nyman,,,ICCE,,2024,10.58459/ICCE.2024.4970,https://doi.org/10.58459/icce.2024.4970,DBLP,,
conf/icce/VizcondeC024,Generative Artificial Intelligence in Education: Evaluating Students&apos; Self-Efficacy and Utilization in Their Homework.,Elanie Vizconde;Ma. Rowena R. Caguiat;Ethel Ong 0001,,,ICCE,,2024,10.58459/ICCE.2024.4885,https://doi.org/10.58459/icce.2024.4885,DBLP,,
conf/iccr/El-KhaliliAA24,The Impact of Generative Artificial Intelligence on Learning: A Case Study at the University of Petra.,Nuha El-Khalili;May Y. Al-Nashashibi;Salam Al-E&apos;mari,,,ICCR,,2024,10.1109/ICCR61006.2024.10532824,https://doi.org/10.1109/ICCR61006.2024.10532824,DBLP,,
conf/icdec/XavierO24,Construction of Knowledge with Strategies Enabled by Generative Artificial Intelligence.,Marcos César Xavier;Selma Oliveira,,,ICDEc,,2024,10.1007/978-3-031-76365-6_9,https://doi.org/10.1007/978-3-031-76365-6_9,DBLP,,
conf/icdsm/TangWLT24,Amplifying Learning and Teaching Effectiveness through Generative Artificial Intelligence: A Qualitative Approach with Case Studies on Supply Chain and Cold Chain Management.,Valerie Tang;Lap Wong;Hoi Yan Lam;Yuk-Ming Tang,,,ICDSM,,2024,10.1145/3686081.3686126,https://doi.org/10.1145/3686081.3686126,DBLP,,
conf/ice-itmc/HeimburgSW24,Generative Artificial Intelligence Platform Ecosystems.,Vincent Heimburg;Maximilian Schreieck;Manuel Wiesche,,,ICE/ITMC,,2024,10.1109/ICE/ITMC61926.2024.10794416,https://doi.org/10.1109/ICE/ITMC61926.2024.10794416,DBLP,,
conf/iceed/GunawanS24,Impact of Generative Artificial Intelligence Deepfake Content on Digital Consumers: A Systematic Literature Review.,Stephanus Steven Gunawan;Indrajani Sutedja,,,ICEED,,2024,10.1109/ICEED62316.2024.10923822,https://doi.org/10.1109/ICEED62316.2024.10923822,DBLP,,
conf/iceis/DaaseHNZRT24,On the Current State of Generative Artificial Intelligence: A Conceptual Model of Potentials and Challenges.,Christian Daase;Christian Haertel;Abdulrahman Nahhas;Alexander Zeier;Achim Ramesohl;Klaus Turowski,,,ICEIS,,2024,10.5220/0012707500003690,https://doi.org/10.5220/0012707500003690,DBLP,,
conf/iceis/RozendoLRTNN24,X-GAN: Generative Adversarial Networks Training Guided with Explainable Artificial Intelligence.,Guilherme Botazzo Rozendo;Alessandra Lumini;Guilherme Freire Roberto;Thaína Aparecida Azevedo Tosta;Marcelo Zanchetta do Nascimento;Leandro Alves Neves,,,ICEIS,,2024,10.5220/0012618400003690,https://doi.org/10.5220/0012618400003690,DBLP,,
conf/icfet/QiW24,Learning Assessment for Open Education Learners in the Era of Generative Artificial Intelligence.,Yuanyi Qi;Lamei Wang,,,ICFET,,2024,10.1145/3678392.3678405,https://doi.org/10.1145/3678392.3678405,DBLP,,
conf/ichi/KopitarSB024,Personalized Meal Planning in Inpatient Clinical Dietetics Using Generative Artificial Intelligence: System Description.,Leon Kopitar;Gregor Stiglic;Leon Bedrac;Jiang Bian 0001,,,ICHI,,2024,10.1109/ICHI61247.2024.00049,https://doi.org/10.1109/ICHI61247.2024.00049,DBLP,,
conf/icimtech/MeilaniAC24,Analysis Factors Affecting Student Intention to Use Generative Artificial Intelligence in E-Learning.,Meilani;Mediana Aryuni;Sevenpri Candra,,,ICIMTech,,2024,10.1109/ICIMTECH63123.2024.10780796,https://doi.org/10.1109/ICIMTech63123.2024.10780796,DBLP,,
conf/icis/PecherDKK24,Sharing is Caring: The Impact of Generative Artificial Intelligence on Motivation and Effort of Knowledge Sharing.,Philipp Pecher;Till Ole Diesterhöft;Felix Kegel;Lutz M. Kolbe,,,ICIS,,2024,,https://aisel.aisnet.org/icis2024/user_behav/user_behav/13,DBLP,,
conf/icis/Wu-GehbauerR24,Unlocking the Potential of Generative Artificial Intelligence: A Case Study in Software Development.,Mei Wu-Gehbauer;Christoph Rosenkranz,,,ICIS,,2024,,https://aisel.aisnet.org/icis2024/aiinbus/aiinbus/25,DBLP,,
conf/icis/Zhang024,Algorithm Aversion to Generative Artificial Intelligence in Creative Content.,Xiaoyu Zhang;Qinghua Zhu 0002,,,ICIS,,2024,,https://aisel.aisnet.org/icis2024/aiinbus/aiinbus/33,DBLP,,
conf/icse/Rinard24,Software Engineering Research in a World with Generative Artificial Intelligence.,,,,ICSE,,2024,10.1145/3597503.3649399,https://doi.org/10.1145/3597503.3649399,DBLP,,
conf/ictai/PanagouliasPBDV24,Memory and Schema in Human-Generative Artificial Intelligence Interactions.,Dimitrios P. Panagoulias;Persephone Papatheodosiou;Anastasios Bonakis;Dimitrios Dikeos;Maria Virvou;George A. Tsihrintzis,,,ICTAI,,2024,10.1109/ICTAI62512.2024.00072,https://doi.org/10.1109/ICTAI62512.2024.00072,DBLP,,
conf/igarss/WagnerGMTBYBG24,A Generative Artificial Intelligence Framework for Earth Observation Analysis.,Otto Wagner;Jeffrey Gordon;Aya Mousa;Brian B. Terry;Joshua R. Baptist;Oguz Yetkin;David Borges;Sanjay Gowda,,,IGARSS,,2024,10.1109/IGARSS53475.2024.10641192,https://doi.org/10.1109/IGARSS53475.2024.10641192,DBLP,,
conf/in4pl/BoaretoSLDS24,Accelerating Industry 4.0 and 5.0: The Potential of Generative Artificial Intelligence.,Pedro Antonio Boareto;Anderson Luis Szejka;Eduardo de Freitas Rocha Loures;Fernando Deschamps;Eduardo Alves Portela Santos,,,IN4PL,,2024,10.1007/978-3-031-80760-2_29,https://doi.org/10.1007/978-3-031-80760-2_29,DBLP,,
conf/iscc/SamarasMXTCB24,Democratizing Predictive Analytics with Generative Artificial Intelligence towards AI-Native Networks.,Georgios Samaras;Marinela Mertiri;Maria-Evgenia Xezonaki;Vasileios Theodorou;Panteleimon-Konstantinos Chartsias;Theodoros Bozios,,,ISCC,,2024,10.1109/ISCC61673.2024.10733560,https://doi.org/10.1109/ISCC61673.2024.10733560,DBLP,,
conf/iscid/CaoX24,Pathways and Strategies for Culturally Empowering Agricultural Product Branding through the Lens of Generative Artificial Intelligence.,Wei Cao;Yongcheng Xie,,,ISCID,,2024,10.1109/ISCID63852.2024.00022,https://doi.org/10.1109/ISCID63852.2024.00022,DBLP,,
conf/isdfs/TorreC24,Generative Artificial Intelligence in Latin American Higher Education: A Systematic Literature Review.,Alejandra de la Torre;Maria G. Baldeon Calisto,,,ISDFS,,2024,10.1109/ISDFS60797.2024.10527283,https://doi.org/10.1109/ISDFS60797.2024.10527283,DBLP,,
conf/ism2/AromaaHJPVJ24,Company perspectives of generative artificial intelligence in industrial work.,Susanna Aromaa;Päivi Heikkilä;Marko Jurvansuu;Selen Pehlivan;Teijo Väärä;Marko Jurmu,,,ISM,,2024,10.1016/J.PROCS.2025.01.085,https://doi.org/10.1016/j.procs.2025.01.085,DBLP,,
conf/ismar/ZhangBKL24,Designing Generative Artificial Intelligence Integrated Immersive Virtual Reality Therapeutic Experiences to Support Meaning-centered Grief Therapies for Bereaved Parents.,Lei Zhang;Anisah Bagasra;Erica Kaye;Wendy G. Lichtenthal,,,ISMAR-Adjunct,,2024,10.1109/ISMAR-ADJUNCT64951.2024.00068,https://doi.org/10.1109/ISMAR-Adjunct64951.2024.00068,DBLP,,
conf/isncc/Mulongo24a,Optimisation of Manufacturing Workflow Through Generative Artificial Intelligence.,,,,ISNCC,,2024,10.1109/ISNCC62547.2024.10758970,https://doi.org/10.1109/ISNCC62547.2024.10758970,DBLP,,
conf/issre/WangCM24,Towards Improved Perception System&apos;s Generalization Through Generative Artificial Intelligence.,Jiawei Wang;João R. Campos;Henrique Madeira,,,ISSRE,,2024,10.1109/ISSREW63542.2024.00101,https://doi.org/10.1109/ISSREW63542.2024.00101,DBLP,,
conf/ital-ia/GravinoIMPP24,Teachers Interacting with Generative Artificial Intelligence: A Dual Responsibility.,Carmine Gravino;Alessandro Iannella;Mirko Marras;Silvio Marcello Pagliara;Fabio Palomba,,,Ital-IA,,2024,,https://ceur-ws.org/Vol-3762/579.pdf,DBLP,,
conf/its/NikouGVC24,A Generative Artificial Intelligence Empowered Chatbot: System Usability and Student Teachers&apos; Experience.,Stavros A. Nikou;Arjun Guliya;Suraj Van Verma;Maiga Chang,,,ITS,,2024,10.1007/978-3-031-63028-6_27,https://doi.org/10.1007/978-3-031-63028-6_27,DBLP,,
conf/keshcis/TakeuchiHY24,Method for Identifying Business Goals for Generative Artificial Intelligence Applications Based on Knowledge Distribution Models and GQM+Strategies.,Hironori Takeuchi;Ralf-Christian Härting;Shuichiro Yamamoto,,,KES-HCIS,,2024,10.1007/978-981-97-8598-8_17,https://doi.org/10.1007/978-981-97-8598-8_17,DBLP,,
conf/lak/GargHCFS24,Automated Discourse Analysis via Generative Artificial Intelligence.,Ryan Garg;Jaeyoung Han;Yixin Cheng;Zheng Fang;Zachari Swiecki,,,LAK,,2024,10.1145/3636555.3636879,https://doi.org/10.1145/3636555.3636879,DBLP,,
conf/lats/LiGLX24,Automated Quality Assessment of Multimodal Mathematical Stories Generated by Generative Artificial Intelligence.,Hai Li;Rui Guo;Chenglu Li;Wanli Xing,,,L@S,,2024,10.1145/3657604.3662029,https://doi.org/10.1145/3657604.3662029,DBLP,,
conf/lats/LinCGK24,MuFIN: A Framework for Automating Multimodal Feedback Generation using Generative Artificial Intelligence.,Jionghao Lin;Eason Chen;Ashish Gurung;Kenneth R. Koedinger,,,L@S,,2024,10.1145/3657604.3664720,https://doi.org/10.1145/3657604.3664720,DBLP,,
conf/mc/ZakreuskayaMDMEPDWGATMB24,Workshop on Generative Artificial Intelligence in Interactive Systems: Experiences from the Community.,Anastasiya Zakreuskaya;Tobias Münch;Henrik Detjen;Sven Mayer;Passant Elagroudy;Bastian Pleging;Fiona Draxler;Benjamin Weyers;Uwe Gruenefeld;Jonas Auda;Waldemar Titov;Wendy E. Mackay;Daniel Buschek;Thomas Kosch,,,MuC,,2024,10.18420/MUC2024-MCI-WS09-123,https://doi.org/10.18420/muc2024-mci-ws09-123,DBLP,,
conf/metroxraine/GerardiniSBPGC24,Comparing UX Profile of Generative Artificial Intelligence Tools and Traditional Tools in Brainstorming Sessions: A Pilot Study.,Katusha Gerardini;Eleonora D. Sarcinella;Francesca Borghesi;Andrea Pozzi;Andrea Gaggioli;Alice Chirico,,,MetroXRAINE,,2024,10.1109/METROXRAINE62247.2024.10796552,https://doi.org/10.1109/MetroXRAINE62247.2024.10796552,DBLP,,
conf/mipro/GilstrapBG24,"Understanding the Adoption of Generative Artificial Intelligence within Communities of Practice: A Cross-Practice, Machine Learning-Based Lexical Study.",Curt A. Gilstrap;Dinko Bacic;Cristina M. Gilstrap,,,MIPRO,,2024,10.1109/MIPRO60963.2024.10569536,https://doi.org/10.1109/MIPRO60963.2024.10569536,DBLP,,
conf/mipro/SantosUM24,Generative Artificial Intelligence in Teaching and Learning of ICT Engineering Education: A Literature Review and Illustrative Scenarios.,Patricia Santos;Keysha Urgel;Verónica Moreno,,,MIPRO,,2024,10.1109/MIPRO60963.2024.10569779,https://doi.org/10.1109/MIPRO60963.2024.10569779,DBLP,,
conf/mis4tel/DingG24,A Study on Analyzing Classroom Teaching Questions Supported by Generative Artificial Intelligence.,Tian Ding;Jiong Guo,,,MIS4TEL,,2024,10.1007/978-3-031-73538-7_5,https://doi.org/10.1007/978-3-031-73538-7_5,DBLP,,
conf/pacis/HarrWS24,Towards Enhanced E-Learning Within MOOCs: Exploring the Capabilities of Generative Artificial Intelligence.,Michael Dominic Harr;Mareen Wienand;Reinhard Schütte,,,PACIS,,2024,,https://aisel.aisnet.org/pacis2024/track14_educ/track14_educ/11,DBLP,,
conf/sbsi/SantosFMDAS24,How Do Information Technology Professionals Use Generative Artificial Intelligence?,Patricia de Oliveira Santos;Allan Chamon Figueiredo;Pedro Nuno de Souza Moura;Bruna Diirr;Adriana C. F. Alvim;Rodrigo Pereira dos Santos,,,SBSI,,2024,10.1145/3658321.3658367,https://doi.org/10.1145/3658321.3658367,DBLP,,
conf/sbsi/SantosFMDAS24a,Impacts of the Usage of Generative Artificial Intelligence on Software Development Process.,Patricia de Oliveira Santos;Allan Chamon Figueiredo;Pedro Nuno de Souza Moura;Bruna Diirr;Adriana C. F. Alvim;Rodrigo Pereira dos Santos,,,SBSI,,2024,10.1145/3658271.3658337,https://doi.org/10.1145/3658271.3658337,DBLP,,
conf/sds2/VarmaSRB24,Reimagining Enterprise Data Management using Generative Artificial Intelligence.,Sandeep Varma;Shivam;Biswarup Ray;Snigdha Biswas,,,SDS,,2024,10.1109/SDS60720.2024.00023,https://doi.org/10.1109/SDS60720.2024.00023,DBLP,,
conf/sigite/BeatonWZ24,Instructional Approaches Complementing the Use of Generative Artificial Intelligence in Higher Education.,Catherine I. Beaton;Elissa Weeden;Stephen J. Zilora,,,SIGITE,,2024,10.1145/3686852.3687075,https://doi.org/10.1145/3686852.3687075,DBLP,,
conf/sohoma/BerrahTG24,Ethical Issues in the Use of Generative Artificial Intelligence in Performance Management: Industrial Case Studies.,Lamia Berrah;Damien Trentesaux;Frederic Guerre-Chaley,,,SOHOMA,,2024,10.1007/978-3-031-85316-6_3,https://doi.org/10.1007/978-3-031-85316-6_3,DBLP,,
conf/vrst/BehravanG24,Generative Multi-Modal Artificial Intelligence for Dynamic Real-Time Context-Aware Content Creation in Augmented Reality.,Majid Behravan;Denis Gracanin,,,VRST,,2024,10.1145/3641825.3689685,https://doi.org/10.1145/3641825.3689685,DBLP,,
conf/wcre/Cassieri0S24,Generative Artificial Intelligence for Test-Driven Development: GAI4- TDD.,Pietro Cassieri;Simone Romano 0001;Giuseppe Scanniello,,,SANER,,2024,10.1109/SANER60148.2024.00098,https://doi.org/10.1109/SANER60148.2024.00098,DBLP,,
conf/webi/ZhouXT24,The Mode and Strategy of Generative Artificial Intelligence Enabling Teaching from the Perspective of Human-Computer Collaboration.,Peijie Zhou;Haixia Xu;Yang Tan,,,WI/IAT,,2024,10.1109/WI-IAT62293.2024.00128,https://doi.org/10.1109/WI-IAT62293.2024.00128,DBLP,,
conf/wirtschaftsinformatik/Hohener24,Dynamic Capabilities to Manage Generative Artificial Intelligence in Digital Transformation Efforts.,,,,Wirtschaftsinformatik,,2024,,https://aisel.aisnet.org/wi2024/1,DBLP,,
conf/wsc/VillaplanaKLLC24,Application of Generative Artificial Intelligence for Epidemic Modeling.,Hannah Danielle Ladera Villaplana;Jaeyoung Kwak;Michael H. Lees;Hongying Li;Wentong Cai 0001,,,WSC,,2024,10.1109/WSC63780.2024.10838918,https://doi.org/10.1109/WSC63780.2024.10838918,DBLP,,
books/sp/24/ClorionAFSNMPAV24,"Artificial Intelligence in Academic Writing in Higher Education in a Country of Emerging Economy: An Analysis of Knowledge, Perceived Influence, Extent of Use and Perception.",Frenz Djaxxas D. Clorion;Ericson O. Alieto;Justine O. Fuentes;Dinnesse Joi B. Suicano;Eric-Roland Natividad;Manilyn V. Miñoza;Anthony O. Pil;Fhadzralyn Aidil-Karanain;Rubén González Vallejo,,,General Aspects of Applying Generative AI in Higher Education,,2024,10.1007/978-3-031-65691-0_16,https://doi.org/10.1007/978-3-031-65691-0_16,DBLP,,
conf/gaiis/2024,"2024 International Conference on Generative Artificial Intelligence and Information Security, GAIIS 2024, Kuala Lumpur, Malaysia, May 10-12, 2024",,,,GAIIS,,2024,10.1145/3665348,https://doi.org/10.1145/3665348,DBLP,,
data/11/Choudhary24a,"Embracing the future of Endpoint Management powered by Generative Artificial Intelligence to enhance data security, IT operational Efficiency, and regulatory compliance.",,,,IEEE DataPort,,2024,10.21227/2HAY-WV87,https://doi.org/10.21227/2hay-wv87,DBLP,,
data/11/CondeCMRS24,Recursiveness in Multimodal Generative Artificial Intelligence.,Javier Conde;Tobias Cheung;Gonzalo Martínez 0001;Pedro Reviriego;Rik Sarkar,,,Zenodo,,2024,10.5281/ZENODO.13362647,https://doi.org/10.5281/zenodo.13362647,DBLP,,
journals/corr/abs-2401-05377,The impact of generative artificial intelligence on socioeconomic inequalities and policy making.,Valerio Capraro;Austin Lentsch;Daron Acemoglu;Selin Akgün;Aisel Akhmedova;Ennio Bilancini;Jean-François Bonnefon;Pablo Brañas-Garza;Luigi Butera;Karen M. Douglas;Jim A. C. Everett;Gerd Gigerenzer;Christine Greenhow;Daniel A. Hashimoto;Julianne Holt-Lunstad;Jolanda Jetten;Simon Johnson;Chiara Longoni;Pete Lunn;Simone Natale;Iyad Rahwan;Neil Selwyn;Vivek Singh;Siddharth Suri;Jennifer Sutcliffe;Joe Tomlinson;Sander van der Linden;Paul A. M. Van Lange;Friederike Wall;Jay J. Van Bavel;Riccardo Viale,,,CoRR,,2024,10.48550/ARXIV.2401.05377,https://doi.org/10.48550/arXiv.2401.05377,DBLP,,
journals/corr/abs-2402-01659,Generative Artificial Intelligence in Higher Education: Evidence from an Analysis of Institutional Policies and Guidelines.,Nora McDonald;Aditya Johri;Areej Ali;Aayushi Hingle,,,CoRR,,2024,10.48550/ARXIV.2402.01659,https://doi.org/10.48550/arXiv.2402.01659,DBLP,,
journals/corr/abs-2402-05122,"History of generative Artificial Intelligence (AI) chatbots: past, present, and future development.",Md. Al-Amin;Mohammad Shazed Ali;Abdus Salam;Arif Khan;Ashraf Ali;Ahsan Ullah;Md. Nur Alam;Shamsul Kabir Chowdhury,,,CoRR,,2024,10.48550/ARXIV.2402.05122,https://doi.org/10.48550/arXiv.2402.05122,DBLP,,
journals/corr/abs-2402-11707,Search Engines Post-ChatGPT: How Generative Artificial Intelligence Could Make Search Less Reliable.,Shahan Ali Memon;Jevin D. West,,,CoRR,,2024,10.48550/ARXIV.2402.11707,https://doi.org/10.48550/arXiv.2402.11707,DBLP,,
journals/corr/abs-2403-02558,Updating the Minimum Information about CLinical Artificial Intelligence (MI-CLAIM) checklist for generative modeling research.,Brenda Y. Miao;Irene Y. Chen;Christopher Y. K. Williams;Jaysón M. Davidson;Augusto Garcia-Agundez;Harry Sun;Travis Zack;Atul J. Butte;Madhumita Sushil,,,CoRR,,2024,10.48550/ARXIV.2403.02558,https://doi.org/10.48550/arXiv.2403.02558,DBLP,,
journals/corr/abs-2403-08802,Governance of Generative Artificial Intelligence for Companies.,Johannes Schneider 0002;Rene Abraham;Christian Meske,,,CoRR,,2024,10.48550/ARXIV.2403.08802,https://doi.org/10.48550/arXiv.2403.08802,DBLP,,
journals/corr/abs-2403-14654,"ChatGPT in Veterinary Medicine: A Practical Guidance of Generative Artificial Intelligence in Clinics, Education, and Research.",,,,CoRR,,2024,10.48550/ARXIV.2403.14654,https://doi.org/10.48550/arXiv.2403.14654,DBLP,,
journals/corr/abs-2404-03321,Fusion of Mixture of Experts and Generative Artificial Intelligence in Mobile Edge Metaverse.,Guangyuan Liu;Hongyang Du;Dusit Niyato;Jiawen Kang 0001;Zehui Xiong;Abbas Jamalipour;Shiwen Mao;Dong In Kim,,,CoRR,,2024,10.48550/ARXIV.2404.03321,https://doi.org/10.48550/arXiv.2404.03321,DBLP,,
journals/corr/abs-2404-09479,A Legal Risk Taxonomy for Generative Artificial Intelligence.,David Atkinson;Jacob Morrison,,,CoRR,,2024,10.48550/ARXIV.2404.09479,https://doi.org/10.48550/arXiv.2404.09479,DBLP,,
journals/corr/abs-2404-18077,Generative AI for Low-Carbon Artificial Intelligence of Things.,Jinbo Wen;Ruichen Zhang;Dusit Niyato;Jiawen Kang 0001;Hongyang Du;Yang Zhang 0025;Zhu Han 0001,,,CoRR,,2024,10.48550/ARXIV.2404.18077,https://doi.org/10.48550/arXiv.2404.18077,DBLP,,
journals/corr/abs-2404-18550,IncidentResponseGPT: Generating Traffic Incident Response Plans with Generative Artificial Intelligence.,Artur Grigorev 0001;Khaled Saleh;Yuming Ou,,,CoRR,,2024,10.48550/ARXIV.2404.18550,https://doi.org/10.48550/arXiv.2404.18550,DBLP,,
journals/corr/abs-2405-00995,Not a Swiss Army Knife: Academics&apos; Perceptions of Trade-Offs Around Generative Artificial Intelligence Use.,Afsaneh Razi;Layla Bouzoubaa;Aria Pessianzadeh;John S. Seberger;Rezvaneh Rezapour,,,CoRR,,2024,10.48550/ARXIV.2405.00995,https://doi.org/10.48550/arXiv.2405.00995,DBLP,,
journals/corr/abs-2405-11612,Sociotechnical Implications of Generative Artificial Intelligence for Information Access.,Bhaskar Mitra 0001;Henriette Cramer;Olya Gurevich,,,CoRR,,2024,10.48550/ARXIV.2405.11612,https://doi.org/10.48550/arXiv.2405.11612,DBLP,,
journals/corr/abs-2405-15406,A Misleading Gallery of Fluid Motion by Generative Artificial Intelligence.,,,,CoRR,,2024,10.48550/ARXIV.2405.15406,https://doi.org/10.48550/arXiv.2405.15406,DBLP,,
journals/corr/abs-2406-01862,Charting the Landscape of Nefarious Uses of Generative Artificial Intelligence for Online Election Interference.,,,,CoRR,,2024,10.48550/ARXIV.2406.01862,https://doi.org/10.48550/arXiv.2406.01862,DBLP,,
journals/corr/abs-2406-10557,Explain the Black Box for the Sake of Science: Revisiting the Scientific Method in the Era of Generative Artificial Intelligence.,,,,CoRR,,2024,10.48550/ARXIV.2406.10557,https://doi.org/10.48550/arXiv.2406.10557,DBLP,,
journals/corr/abs-2406-12296,Generative Artificial Intelligence-Guided User Studies: An Application for Air Taxi Services.,Shengdi Xiao;Jingjing Li;Tatsuki Fushimi;Yoichi Ochiai,,,CoRR,,2024,10.48550/ARXIV.2406.12296,https://doi.org/10.48550/arXiv.2406.12296,DBLP,,
journals/corr/abs-2406-12449,Retrieval-Augmented Generation for Generative Artificial Intelligence in Medicine.,Rui Yang 0016;Yilin Ning;Emilia Keppo;Mingxuan Liu;Chuan Hong;Danielle S. Bitterman;Jasmine Chiat Ling Ong;Daniel Shu Wei Ting;Nan Liu 0003,,,CoRR,,2024,10.48550/ARXIV.2406.12449,https://doi.org/10.48550/arXiv.2406.12449,DBLP,,
journals/corr/abs-2406-14769,How critically can an AI think? A framework for evaluating the quality of thinking of generative artificial intelligence.,Luke Zaphir;Jason M. Lodge;Jacinta Lisec;Dom McGrath;Hassan Khosravi,,,CoRR,,2024,10.48550/ARXIV.2406.14769,https://doi.org/10.48550/arXiv.2406.14769,DBLP,,
journals/corr/abs-2406-18247,Generative artificial intelligence in ophthalmology: multimodal retinal images for the diagnosis of Alzheimer&apos;s disease with convolutional neural networks.,I. R. Slootweg;M. Thach;K. R. Curro-Tafili;F. D. Verbraak;F. H. Bouwman;Y. A. L. Pijnenburg;J. F. Boer;J. H. P. de Kwisthout;L. Bagheriye;P. J. González,,,CoRR,,2024,10.48550/ARXIV.2406.18247,https://doi.org/10.48550/arXiv.2406.18247,DBLP,,
journals/corr/abs-2407-01556,A Taxonomy of the Biases of the Images created by Generative Artificial Intelligence.,Adriana Fernández de Caleya Vázquez;Eduardo C. Garrido-Merchán,,,CoRR,,2024,10.48550/ARXIV.2407.01556,https://doi.org/10.48550/arXiv.2407.01556,DBLP,,
journals/corr/abs-2407-04882,Improving ensemble extreme precipitation forecasts using generative artificial intelligence.,Yingkai Sha;Ryan A. Sobash;David John Gagne II,,,CoRR,,2024,10.48550/ARXIV.2407.04882,https://doi.org/10.48550/arXiv.2407.04882,DBLP,,
journals/corr/abs-2407-09013,Procedural Content Generation via Generative Artificial Intelligence.,Xinyu Mao;Wanli Yu;Kazunori D. Yamada;Michael R. Zielewski,,,CoRR,,2024,10.48550/ARXIV.2407.09013,https://doi.org/10.48550/arXiv.2407.09013,DBLP,,
journals/corr/abs-2407-10554,Beyond Generative Artificial Intelligence: Roadmap for Natural Language Generation.,María Miró Maestre;Iván Martínez-Murillo;Tania Josephine Martin;Borja Navarro-Colorado;Antonio Ferrández;Armando Suárez Cueto;Elena Lloret,,,CoRR,,2024,10.48550/ARXIV.2407.10554,https://doi.org/10.48550/arXiv.2407.10554,DBLP,,
journals/corr/abs-2407-12004,"An investigation into the scientific landscape of the conversational and generative artificial intelligence, and human-chatbot interaction in education and research.",Ikpe Justice Akpan;Yawo Mamoua Kobara;Josiah Owolabi;Asuama Akpam;Onyebuchi Felix Offodile,,,CoRR,,2024,10.48550/ARXIV.2407.12004,https://doi.org/10.48550/arXiv.2407.12004,DBLP,,
journals/corr/abs-2407-16902,The Potential and Perils of Generative Artificial Intelligence for Quality Improvement and Patient Safety.,Laleh Jalilian;Daniel McDuff;Achuta Kadambi,,,CoRR,,2024,10.48550/ARXIV.2407.16902,https://doi.org/10.48550/arXiv.2407.16902,DBLP,,
journals/corr/abs-2407-17532,Generative artificial intelligence in dentistry: Current approaches and future challenges.,Fabián Villena;Claudia Véliz;Rosario García-Huidobro;Sebastián Aguayo,,,CoRR,,2024,10.48550/ARXIV.2407.17532,https://doi.org/10.48550/arXiv.2407.17532,DBLP,,
journals/corr/abs-2407-19088,Unpopular Opinion: Generative Artificial Intelligence Is Not Eroding Academic Integrity.,Myles Joshua Toledo Tan;Nicholle Mae Amor Tan Maravilla,,,CoRR,,2024,10.48550/ARXIV.2407.19088,https://doi.org/10.48550/arXiv.2407.19088,DBLP,,
