ID,Title,Authors,Abstract,Keywords,Journal,Publication_Date,Year,DOI,URL,Source,Country,Language
https://openalex.org/W4386075858,Generative Diffusion Prior for Unified Image Restoration and Enhancement,Ben Fei;Zhaoyang Lyu;Liang Pan;Junzhe Zhang;Weidong Yang;Tianyue Luo;Bo Zhang;Bo Dai,Abstract available,,,,2023,10.1109/cvpr52729.2023.00958,https://arxiv.org/pdf/2304.01247,OPENALEX,,
https://openalex.org/W4312198153,Broadly applicable and accurate protein design by integrating structure prediction networks and diffusion generative models,Joseph L. Watson;David Juergens;Nathaniel R. Bennett;Brian L. Trippe;Jason Yim;Helen E. Eisenach;Woody Ahern;Andrew J. Borst;Robert J. Ragotte;Lukas F. Milles;Basile I. M. Wicky;Nikita Hanikel;Samuel J. Pellock;Alexis Courbet;William Sheffler;Jue Wang;Preetham Venkatesh;Isaac Sappington;Susana Vázquez Torres;Anna Lauko;Valentin De Bortoli;Émile Mathieu;Regina Barzilay;Tommi Jaakkola;Frank DiMaio;Minkyung Baek;David Baker,Abstract available,,bioRxiv (Cold Spring Harbor Laboratory),,2022,10.1101/2022.12.09.519842,https://www.biorxiv.org/content/biorxiv/early/2022/12/14/2022.12.09.519842.full.pdf,OPENALEX,,
https://openalex.org/W3200806939,Structure-based <i>de novo</i> drug design using 3D deep generative models,Yibo Li;Jianfeng Pei;Luhua Lai,Abstract available,,Chemical Science,,2021,10.1039/d1sc04444c,https://pubs.rsc.org/en/content/articlepdf/2021/sc/d1sc04444c,OPENALEX,,
https://openalex.org/W4367602258,scGPT: Towards Building a Foundation Model for Single-Cell Multi-omics Using Generative AI,Haotian Cui;Xiaoming Wang;Hassaan Maan;Kuan Pang;Fengning Luo;Bo Wang,Abstract available,,bioRxiv (Cold Spring Harbor Laboratory),,2023,10.1101/2023.04.30.538439,https://www.biorxiv.org/content/biorxiv/early/2023/07/02/2023.04.30.538439.full.pdf,OPENALEX,,
https://openalex.org/W4386066388,RODIN: A Generative Model for Sculpting 3D Digital Avatars Using Diffusion,Tengfei Wang;Bo Zhang;Ting Zhang;Shuyang Gu;Jianmin Bao;Tadas Baltrušaitis;Jingjing Shen;Dong Chen;Fang Wen;Qifeng Chen;Baining Guo,Abstract available,,,,2023,10.1109/cvpr52729.2023.00443,https://arxiv.org/pdf/2212.06135,OPENALEX,,
https://openalex.org/W4386913199,Generative AI and ChatGPT in School Children’s Education: Evidence from a School Lesson,Jussi S. Jauhiainen;Agustín Garagorry Guerra,Abstract available,,Sustainability,,2023,10.3390/su151814025,https://www.mdpi.com/2071-1050/15/18/14025/pdf?version=1695347129,OPENALEX,,
https://openalex.org/W3177994886,Generative hypergraph clustering: From blockmodels to modularity,Philip S. Chodrow;Nate Veldt;Austin R. Benson,Abstract available,,Science Advances,,2021,10.1126/sciadv.abh1303,https://www.science.org/doi/pdf/10.1126/sciadv.abh1303?download=true,OPENALEX,,
https://openalex.org/W4396685186,"Advancements in Generative AI: A Comprehensive Review of GANs, GPT, Autoencoders, Diffusion Model, and Transformers",Staphord Bengesi;Hoda El-Sayed;Md Kamruzzaman Sarker;Yao Houkpati;John Irungu;Timothy Oladunni,,,IEEE Access,,2024,10.1109/access.2024.3397775,https://doi.org/10.1109/access.2024.3397775,OPENALEX,,
https://openalex.org/W3195161349,Molecular design in drug discovery: a comprehensive review of deep generative models,Yu Cheng;Yongshun Gong;Yuansheng Liu;Bosheng Song;Quan Zou,Abstract available,,Briefings in Bioinformatics,,2021,10.1093/bib/bbab344,null,OPENALEX,,
https://openalex.org/W3185391990,Chemical language models enable navigation in sparsely populated chemical space,Michael A. Skinnider;R. Greg Stacey;David S. Wishart;Leonard J. Foster,,,Nature Machine Intelligence,,2021,10.1038/s42256-021-00368-1,null,OPENALEX,,
https://openalex.org/W4312463400,End-to-end Generative Pretraining for Multimodal Video Captioning,Paul Hongsuck Seo;Arsha Nagrani;Anurag Arnab;Cordelia Schmid,Abstract available,,,,2022,10.1109/cvpr52688.2022.01743,https://arxiv.org/pdf/2201.08264,OPENALEX,,
https://openalex.org/W4384644330,Diffusion Recommender Model,Wenjie Wang;Yiyan Xu;Fuli Feng;Xinyu Lin;Xiangnan He;Tat?Seng Chua,Abstract available,,,,2023,10.1145/3539618.3591663,https://arxiv.org/pdf/2304.04971,OPENALEX,,
https://openalex.org/W4386076190,High-resolution image reconstruction with latent diffusion models from human brain activity,Yu Takagi;Shinji Nishimoto,Abstract available,,,,2023,10.1109/cvpr52729.2023.01389,https://doi.org/10.1101/2022.11.18.517004,OPENALEX,,
https://openalex.org/W3207575373,Solving Inverse Problems in Medical Imaging with Score-Based Generative Models,Yang Song;Liyue Shen;Lei Xing;Stefano Ermon,Abstract available,,arXiv (Cornell University),,2021,10.48550/arxiv.2111.08005,https://arxiv.org/abs/2111.08005,OPENALEX,,
https://openalex.org/W3154314696,Uncertainty Inspired RGB-D Saliency Detection,Jing Zhang;Deng-Ping Fan;Yuchao Dai;Saeed Anwar;Fatemeh Sadat Saleh;Sadegh Aliakbarian;Nick Barnes,Abstract available,,IEEE Transactions on Pattern Analysis and Machine Intelligence,,2021,10.1109/tpami.2021.3073564,http://arxiv.org/pdf/2009.03075,OPENALEX,,
https://openalex.org/W3212335243,Unsupervised deep learning identifies semantic disentanglement in single inferotemporal face patch neurons,Irina Higgins;Le Chang;Victoria Langston;Demis Hassabis;Christopher Summerfield;Doris Y. Tsao;Matthew Botvinick,Abstract available,,Nature Communications,,2021,10.1038/s41467-021-26751-5,https://www.nature.com/articles/s41467-021-26751-5.pdf,OPENALEX,,
https://openalex.org/W3044862054,Constrained crystals deep convolutional generative adversarial network for the inverse design of crystal structures,Teng Long;Nuno M. Fortunato;Ingo Opahle;Yixuan Zhang;Ilias Samathrakis;Chen Shen;Oliver Gutfleisch;Hongbin Zhang,Abstract available,,npj Computational Materials,,2021,10.1038/s41524-021-00526-4,https://www.nature.com/articles/s41524-021-00526-4.pdf,OPENALEX,,
https://openalex.org/W4308327397,A survey on deep learning applied to medical images: from simple artificial neural networks to generative models,Pedro Celard;Eva Iglesias;José Manuel Sorribes-Fdez;R. Romero;Adrián Seara Vieira;L. Borrajo,,,Neural Computing and Applications,,2022,10.1007/s00521-022-07953-4,https://link.springer.com/content/pdf/10.1007/s00521-022-07953-4.pdf,OPENALEX,,
https://openalex.org/W3127493072,Combining generative artificial intelligence and on-chip synthesis for de novo drug design,Francesca Grisoni;Berend J. H. Huisman;Alexander L. Button;Michaël Moret;Kenneth Atz;Daniel Merk;Gisbert Schneider,Abstract available,,Science Advances,,2021,10.1126/sciadv.abg3338,https://doi.org/10.1126/sciadv.abg3338,OPENALEX,,
https://openalex.org/W4224060952,InCoder: A Generative Model for Code Infilling and Synthesis,Daniel Fried;Armen Aghajanyan;Jessy Lin;Sida Wang;Eric Wallace;Freda Shi;Ruiqi Zhong;Wen-tau Yih;Luke Zettlemoyer;Michael Lewis,Abstract available,,arXiv (Cornell University),,2022,10.48550/arxiv.2204.05999,https://arxiv.org/abs/2204.05999,OPENALEX,,
https://openalex.org/W3170550558,GANplifying event samples,Anja Butter;Sascha Diefenbacher;Gregor Kasieczka;Benjamin Nachman;Tilman Plehn,Abstract available,,SciPost Physics,,2021,10.21468/scipostphys.10.6.139,https://scipost.org/10.21468/SciPostPhys.10.6.139/pdf,OPENALEX,,
https://openalex.org/W4385340890,Towards Adoption of Generative AI in Organizational Settings,Kalyan Prasad Agrawal,Abstract available,,Journal of Computer Information Systems,,2023,10.1080/08874417.2023.2240744,null,OPENALEX,,
https://openalex.org/W4386076288,Generating Human Motion from Textual Descriptions with Discrete Representations,Jianrong Zhang;Yangsong Zhang;Xiaodong Cun;Yong Zhang;Hongwei Zhao;Hongtao Lu;Xi Shen;Ying Shan,Abstract available,,,,2023,10.1109/cvpr52729.2023.01415,null,OPENALEX,,
https://openalex.org/W4384662087,Educator and Student Perspectives on the Impact of Generative AI on Assessments in Higher Education,Adele Smolansky;Andrew Cram;Corina Raduescu;Sandris Zeivots;Elaine Huber;René F. Kizilcec,Abstract available,,,,2023,10.1145/3573051.3596191,null,OPENALEX,,
https://openalex.org/W4324344300,Discovering highly potent antimicrobial peptides with deep generative model HydrAMP,Paulina Szymczak;Marcin Mo?ejko;Tomasz Grzegorzek;Rados?aw Jurczak;Marta Bauer;Damian Neubauer;Karol Sikora;Micha? Michalski;Jacek Sroka;Piotr Setny;Wojciech Kamysz;Ewa Szczurek,Abstract available,,Nature Communications,,2023,10.1038/s41467-023-36994-z,https://www.nature.com/articles/s41467-023-36994-z.pdf,OPENALEX,,
https://openalex.org/W4393993191,Generative AI for Customizable Learning Experiences,Ivica Pesovski;Ricardo Santos;Roberto Henriques;Vladimir Trajkovik,Abstract available,,Sustainability,,2024,10.3390/su16073034,https://www.mdpi.com/2071-1050/16/7/3034/pdf?version=1712310661,OPENALEX,,
https://openalex.org/W4210540254,Generative machine learning algorithm for lattice structures with superior mechanical properties,Sangryun Lee;Zhizhou Zhang;Grace X. Gu,Abstract available,,Materials Horizons,,2022,10.1039/d1mh01792f,null,OPENALEX,,
https://openalex.org/W4312671789,Bailando: 3D Dance Generation by Actor-Critic GPT with Choreographic Memory,Siyao Li;Weijiang Yu;Tianpei Gu;Chunze Lin;Quan Wang;Qian Chen;Chen Change Loy;Ziwei Liu,Abstract available,,,,2022,10.1109/cvpr52688.2022.01077,https://arxiv.org/pdf/2203.13055,OPENALEX,,
https://openalex.org/W4400231442,Simulating 500 million years of evolution with a language model,Thomas Hayes;Roshan Rao;Halil Akin;Nicholas J. Sofroniew;Deniz Oktay;Zeming Lin;Robert Verkuil;Vincent Q. Tran;Jonathan Deaton;Marius Wiggert;Rohil Badkundri;Irhum Shafkat;Jun Gong;Alexander Derry;R. Molina;Neil Thomas;Yousuf A. Khan;Chetan Mishra;Carolyn Kim;Liam J. Bartie;Matthew Nemeth;Patrick D. Hsu;Tom Sercu;Salvatore Candido;Alexander Rives,Abstract available,,bioRxiv (Cold Spring Harbor Laboratory),,2024,10.1101/2024.07.01.600583,null,OPENALEX,,
https://openalex.org/W4388863961,Unifying the design space and optimizing linear and nonlinear truss metamaterials by generative modeling,Li Zheng;Konstantinos Karapiperis;Siddhant Kumar;Dennis M. Kochmann,Abstract available,,Nature Communications,,2023,10.1038/s41467-023-42068-x,https://www.nature.com/articles/s41467-023-42068-x.pdf,OPENALEX,,
https://openalex.org/W4389615177,Generative AI for Economic Research: Use Cases and Implications for Economists,Anton Korinek,Abstract available,,Journal of Economic Literature,,2023,10.1257/jel.20231736,null,OPENALEX,,
https://openalex.org/W4315881236,Generative Language Models and Automated Influence Operations: Emerging Threats and Potential Mitigations,Josh A. Goldstein;Girish Sastry;Micah Musser;Renée DiResta;Matthew Gentzel;Kate?ina Še?ová,Abstract available,,arXiv (Cornell University),,2023,10.48550/arxiv.2301.04246,https://arxiv.org/abs/2301.04246,OPENALEX,,
https://openalex.org/W4386080645,SparseFusion: Distilling View-Conditioned Diffusion for 3D Reconstruction,Zhizhuo Zhou;Shubham Tulsiani,Abstract available,,,,2023,10.1109/cvpr52729.2023.01211,http://arxiv.org/pdf/2212.00792,OPENALEX,,
https://openalex.org/W4221144097,Conditional Diffusion Probabilistic Model for Speech Enhancement,Yen-Ju Lu;Zhong-Qiu Wang;Shinji Watanabe;Alexander Richard;Cheng Yu;Yu Tsao,Abstract available,,,,2022,10.1109/icassp43922.2022.9746901,http://arxiv.org/pdf/2202.05256,OPENALEX,,
https://openalex.org/W4378765257,The Curse of Recursion: Training on Generated Data Makes Models Forget,Ilia Shumailov;Zakhar Shumaylov;Yiren Zhao;Yarin Gal;Nicolas Papernot;Ross Anderson,Abstract available,,arXiv (Cornell University),,2023,10.48550/arxiv.2305.17493,https://arxiv.org/abs/2305.17493,OPENALEX,,
https://openalex.org/W4389523765,Is ChatGPT Good at Search? Investigating Large Language Models as Re-Ranking Agents,Weiwei Sun;Lingyong Yan;Xinyu Ma;Shuaiqiang Wang;Pengjie Ren;Zhumin Chen;Dawei Yin;Zhaochun Ren,Abstract available,,,,2023,10.18653/v1/2023.emnlp-main.923,https://aclanthology.org/2023.emnlp-main.923.pdf,OPENALEX,,
https://openalex.org/W4385571451,Revisiting Relation Extraction in the era of Large Language Models,Somin Wadhwa;Silvio Amir;Byron Wallace,Abstract available,,,,2023,10.18653/v1/2023.acl-long.868,https://aclanthology.org/2023.acl-long.868.pdf,OPENALEX,,
https://openalex.org/W4221149941,GeoDiff: a Geometric Diffusion Model for Molecular Conformation Generation,Minkai Xu;Lantao Yu;Yang Song;Chence Shi;Stefano Ermon;Jian Tang,Abstract available,,arXiv (Cornell University),,2022,10.48550/arxiv.2203.02923,https://arxiv.org/abs/2203.02923,OPENALEX,,
https://openalex.org/W4372272552,Shap-E: Generating Conditional 3D Implicit Functions,Heewoo Jun;Alex Nichol,Abstract available,,arXiv (Cornell University),,2023,10.48550/arxiv.2305.02463,https://arxiv.org/abs/2305.02463,OPENALEX,,
https://openalex.org/W4386071953,Towards Universal Fake Image Detectors that Generalize Across Generative Models,Utkarsh Ojha;Yuheng Li;Yong Jae Lee,Abstract available,,,,2023,10.1109/cvpr52729.2023.02345,https://arxiv.org/pdf/2302.10174,OPENALEX,,
https://openalex.org/W4387950352,Artificial intelligence and increasing misinformation,Scott Monteith;Tasha Glenn;John Geddes;Peter C. Whybrow;Eric D. Achtyes;Michael Bauer,Abstract available,,The British Journal of Psychiatry,,2023,10.1192/bjp.2023.136,https://www.cambridge.org/core/services/aop-cambridge-core/content/view/DCCE0EB214E3D375A3006AA69FFB210D/S0007125023001368a.pdf/div-class-title-artificial-intelligence-and-increasing-misinformation-div.pdf,OPENALEX,,
https://openalex.org/W4389519928,Towards Mitigating LLM Hallucination via Self Reflection,Ziwei Ji;Tiezheng Yu;Yan Xu;Nayeon Lee;Etsuko Ishii;Pascale Fung,Abstract available,,,,2023,10.18653/v1/2023.findings-emnlp.123,https://aclanthology.org/2023.findings-emnlp.123.pdf,OPENALEX,,
https://openalex.org/W4390872095,Diff-Retinex: Rethinking Low-light Image Enhancement with A Generative Diffusion Model,Xunpeng Yi;Han Xu;Hao Zhang;Linfeng Tang;Jiayi Ma,Abstract available,,,,2023,10.1109/iccv51070.2023.01130,http://arxiv.org/pdf/2308.13164,OPENALEX,,
https://openalex.org/W4283588088,Ig-VAE: Generative modeling of protein structure by direct 3D coordinate generation,Raphael R. Eguchi;Christian A. Choe;Po?Ssu Huang,Abstract available,,PLoS Computational Biology,,2022,10.1371/journal.pcbi.1010271,https://journals.plos.org/ploscompbiol/article/file?id=10.1371/journal.pcbi.1010271&type=printable,OPENALEX,,
https://openalex.org/W4313484371,Muse: Text-To-Image Generation via Masked Generative Transformers,Hui?Wen Chang;Han Zhang;Jarred Barber;AJ Maschinot;José Lezama;Lu Jiang;Ming–Hsuan Yang;Kevin Murphy;William T. Freeman;Michael Rubinstein;Yuanzhen Li;Dilip Krishnan,Abstract available,,arXiv (Cornell University),,2023,10.48550/arxiv.2301.00704,https://arxiv.org/abs/2301.00704,OPENALEX,,
https://openalex.org/W4386047807,All are Worth Words: A ViT Backbone for Diffusion Models,Fan Bao;Shen Nie;Kaiwen Xue;Yue Cao;Chongxuan Li;Hang Su;Jun Zhu,Abstract available,,,,2023,10.1109/cvpr52729.2023.02171,http://arxiv.org/pdf/2209.12152,OPENALEX,,
https://openalex.org/W4293327156,Understanding Diffusion Models: A Unified Perspective,Calvin Luo,Abstract available,,arXiv (Cornell University),,2022,10.48550/arxiv.2208.11970,https://arxiv.org/abs/2208.11970,OPENALEX,,
https://openalex.org/W4312046000,Self-Supervised Learning for Videos: A Survey,Madeline C. Schiappa;Yogesh Singh Rawat;Mubarak Shah,Abstract available,,ACM Computing Surveys,,2022,10.1145/3577925,https://doi.org/10.1145/3577925,OPENALEX,,
https://openalex.org/W4386075980,"Diffusion-based Generation, Optimization, and Planning in 3D Scenes",Siyuan Huang;Zan Wang;Puhao Li;Baoxiong Jia;Tengyu Liu;Yixin Zhu;Wei Liang;Song?Chun Zhu,Abstract available,,,,2023,10.1109/cvpr52729.2023.01607,https://arxiv.org/pdf/2301.06015,OPENALEX,,
https://openalex.org/W4390871705,DreamBooth3D: Subject-Driven Text-to-3D Generation,Amit Raj;Srinivas Kaza;Ben Poole;Michael Niemeyer;Nataniel Ruiz;Ben Mildenhall;Shiran Zada;Kfir Aberman;Michael Rubinstein;Jonathan T. Barron;Yuanzhen Li;Varun Jampani,Abstract available,,,,2023,10.1109/iccv51070.2023.00223,https://arxiv.org/pdf/2303.13508,OPENALEX,,
https://openalex.org/W4385497035,Empowering Education through Generative AI: Innovative Instructional Strategies for Tomorrow's Learners,Kadaruddin Kadaruddin,Abstract available,,International Journal of Business Law and Education,,2023,10.56442/ijble.v4i2.215,https://ijble.com/index.php/journal/article/download/215/225,OPENALEX,,
https://openalex.org/W4206615250,Brain Tumor Classification Using a Combination of Variational Autoencoders and Generative Adversarial Networks,Bilal Ahmad;Jun Sun;Qi You;Vasile Palade;Zhongjie Mao,Abstract available,,Biomedicines,,2022,10.3390/biomedicines10020223,https://www.mdpi.com/2227-9059/10/2/223/pdf?version=1642759544,OPENALEX,,
https://openalex.org/W4382652843,How ChatGPT Will Change Software Engineering Education,Marian Daun;Jennifer Brings,Abstract available,,,,2023,10.1145/3587102.3588815,https://doi.org/10.1145/3587102.3588815,OPENALEX,,
https://openalex.org/W4292754606,Cold Diffusion: Inverting Arbitrary Image Transforms Without Noise,Arpit Bansal;Eitan Borgnia;Hongmin Chu;Jie S. Li;Hamid Kazemi;Furong Huang;Micah Goldblum;Jonas Geiping;Tom Goldstein,Abstract available,,arXiv (Cornell University),,2022,10.48550/arxiv.2208.09392,https://arxiv.org/abs/2208.09392,OPENALEX,,
https://openalex.org/W4391334978,Design Principles for Generative AI Applications,Justin D. Weisz;Jessica He;Michael Müller;Gabriela Hoefer;Rachel Miles;Werner Geyer,Abstract available,,,,2024,10.1145/3613904.3642466,https://dl.acm.org/doi/pdf/10.1145/3613904.3642466,OPENALEX,,
https://openalex.org/W4392700107,Do you create your content yourself? Using generative artificial intelligence for social media content creation diminishes perceived brand authenticity,Jasper David Brüns;Martin Meißner,Abstract available,,Journal of Retailing and Consumer Services,,2024,10.1016/j.jretconser.2024.103790,https://doi.org/10.1016/j.jretconser.2024.103790,OPENALEX,,
https://openalex.org/W4362664882,Regression Transformer enables concurrent sequence regression and generation for molecular language modelling,Jannis Born;Matteo Manica,Abstract available,,Nature Machine Intelligence,,2023,10.1038/s42256-023-00639-z,https://www.nature.com/articles/s42256-023-00639-z.pdf,OPENALEX,,
https://openalex.org/W4284974950,AI-enabled image fraud in scientific publications,Jinjin Gu;Xinlei Wang;Chenang Li;Junhua Zhao;Weijin Fu;Gaoqi Liang;Jing Qiu,Abstract available,,Patterns,,2022,10.1016/j.patter.2022.100511,https://www.cell.com/article/S2666389922001039/pdf,OPENALEX,,
https://openalex.org/W4318719586,Extracting Training Data from Diffusion Models,Nicholas Carlini;Jamie Hayes;Milad Nasr;Matthew Jagielski;Vikash Sehwag;Florian Tramèr;Borja Balle;Daphne Ippolito;Eric Wallace,Abstract available,,arXiv (Cornell University),,2023,10.48550/arxiv.2301.13188,https://arxiv.org/abs/2301.13188,OPENALEX,,
https://openalex.org/W4390984237,Understanding the role and impact of Generative Artificial Intelligence (AI) hallucination within consumers’ tourism decision-making processes,Jeff Christensen;Jared M. Hansen;Paul Wilson,Abstract available,,Current Issues in Tourism,,2024,10.1080/13683500.2023.2300032,null,OPENALEX,,
https://openalex.org/W4385738962,From fiction to fact: the growing role of generative AI in business and finance,Boyang Chen;Zongxiao Wu;Ruoran Zhao,Abstract available,,Journal of Chinese Economic and Business Studies,,2023,10.1080/14765284.2023.2245279,https://www.research.ed.ac.uk/files/374019625/ChenEtal2023JCEBSFromFictionToFact.pdf,OPENALEX,,
https://openalex.org/W4353115070,A Complete Survey on Generative AI (AIGC): Is ChatGPT from GPT-4 to GPT-5 All You Need?,Chaoning Zhang;Chenshuang Zhang;Sheng Zheng;Yu Qiao;Chenghao Li;Mengchun Zhang;Sumit Kumar Dam;Chu Myaet Thwal;Ye Lin Tun;Le Huy;Donguk kim;Sung?Ho Bae;Lik?Hang Lee;Yang Yang;Heng Tao Shen;In So Kweon;Choong Seon Hong,Abstract available,,arXiv (Cornell University),,2023,10.48550/arxiv.2303.11717,https://arxiv.org/abs/2303.11717,OPENALEX,,
https://openalex.org/W4386075565,Solving 3D Inverse Problems Using Pre-Trained 2D Diffusion Models,Hyungjin Chung;Dohoon Ryu;Michael T. McCann;Marc Klasky;Jong Chul Ye,Abstract available,,,,2023,10.1109/cvpr52729.2023.02159,https://arxiv.org/pdf/2211.10655,OPENALEX,,
https://openalex.org/W4387801427,Promptify: Text-to-Image Generation through Interactive Prompt Exploration with Large Language Models,Stephen Brade;Bryan Wang;Maurício Sousa;Sageev Oore;Tovi Grossman,Abstract available,,,,2023,10.1145/3586183.3606725,http://arxiv.org/pdf/2304.09337,OPENALEX,,
https://openalex.org/W4390873915,Generative Novel View Synthesis with 3D-Aware Diffusion Models,Eric R. Chan;Koki Nagano;Matthew A. Chan;Alexander W. Bergman;Jeong Joon Park;Axel Levy;Miika Aittala;Shalini De Mello;Tero Karras;Gordon Wetzstein,Abstract available,,,,2023,10.1109/iccv51070.2023.00389,https://arxiv.org/pdf/2304.02602,OPENALEX,,
https://openalex.org/W4302011534,"Generated Faces in the Wild: Quantitative Comparison of Stable Diffusion, Midjourney and DALL-E 2",Ali Borji,Abstract available,,arXiv (Cornell University),,2022,10.48550/arxiv.2210.00586,https://arxiv.org/abs/2210.00586,OPENALEX,,
https://openalex.org/W4225335692,Deep generative models for peptide design,Fangping Wan;Daphne Kontogiorgos-Heintz;César de la Fuente?Núñez,Abstract available,,Digital Discovery,,2022,10.1039/d1dd00024a,https://pubs.rsc.org/en/content/articlepdf/2022/dd/d1dd00024a,OPENALEX,,
https://openalex.org/W4308799019,Data-driven discovery of 2D materials by deep generative models,Peder Lyngby;Kristian S. Thygesen,Abstract available,,npj Computational Materials,,2022,10.1038/s41524-022-00923-3,https://www.nature.com/articles/s41524-022-00923-3.pdf,OPENALEX,,
https://openalex.org/W4380083162,A New Era of Learning: Considerations for ChatGPT as a Tool to Enhance Statistics and Data Science Education,Amanda R. Ellis;Emily Slade,Abstract available,,Journal of Statistics and Data Science Education,,2023,10.1080/26939169.2023.2223609,https://www.tandfonline.com/doi/pdf/10.1080/26939169.2023.2223609?needAccess=true&role=button,OPENALEX,,
https://openalex.org/W4384470461,May the force of text data analysis be with you: Unleashing the power of generative AI for social psychology research,Mohammed Salah;Hussam Al Halbusi;Fadi Abdelfattah,Abstract available,,Computers in Human Behavior Artificial Humans,,2023,10.1016/j.chbah.2023.100006,https://doi.org/10.1016/j.chbah.2023.100006,OPENALEX,,
https://openalex.org/W4390873429,Unleashing Text-to-Image Diffusion Models for Visual Perception,Wenliang Zhao;Yongming Rao;Zuyan Liu;Benlin Liu;Jie Zhou;Jiwen Lu,Abstract available,,,,2023,10.1109/iccv51070.2023.00527,https://arxiv.org/pdf/2303.02153,OPENALEX,,
https://openalex.org/W4389518954,Evaluating Verifiability in Generative Search Engines,Nelson F. Liu;Tianyi Zhang;Percy Liang,Abstract available,,,,2023,10.18653/v1/2023.findings-emnlp.467,https://aclanthology.org/2023.findings-emnlp.467.pdf,OPENALEX,,
https://openalex.org/W4390432359,Integrating Generative AI Into K-12 Curriculums and Pedagogies in India,Durgesh M. Sharma;K. Venkata Ramana;R. Jothilakshmi;Rakesh Verma;B. Uma Maheswari;Sampath Boopathi,Abstract available,,Advances in higher education and professional development book series,,2023,10.4018/979-8-3693-0487-7.ch006,null,OPENALEX,,
https://openalex.org/W4383679937,"Design Ideation with AI - Sketching, Thinking and Talking with Generative Machine Learning Models",Jakob Tholander;Martin Jönsson,Abstract available,,,,2023,10.1145/3563657.3596014,https://dl.acm.org/doi/pdf/10.1145/3563657.3596014,OPENALEX,,
https://openalex.org/W4388834475,Creativity in the age of generative AI,Janet Rafner;Roger E. Beaty;James C. Kaufman;Todd Lubart;Jacob Sherson,,,Nature Human Behaviour,,2023,10.1038/s41562-023-01751-1,null,OPENALEX,,
https://openalex.org/W4366277658,Why open-source generative AI models are an ethical way forward for science,Arthur Spirling,,,Nature,,2023,10.1038/d41586-023-01295-4,https://www.nature.com/articles/d41586-023-01295-4.pdf,OPENALEX,,
https://openalex.org/W4385275714,3DShape2VecSet: A 3D Shape Representation for Neural Fields and Generative Diffusion Models,Biao Zhang;Jiapeng Tang;Matthias Nießner;Peter Wonka,Abstract available,,ACM Transactions on Graphics,,2023,10.1145/3592442,https://dl.acm.org/doi/pdf/10.1145/3592442,OPENALEX,,
https://openalex.org/W4392462461,Sentiment Analysis in the Age of Generative AI,Jan Ole Krugmann;Jochen Hartmann,Abstract available,,Customer Needs and Solutions,,2024,10.1007/s40547-024-00143-4,https://link.springer.com/content/pdf/10.1007/s40547-024-00143-4.pdf,OPENALEX,,
https://openalex.org/W4402565126,Cultural bias and cultural alignment of large language models,Yan Tao;Olga Viberg;Ryan S. Baker;René F. Kizilcec,Abstract available,,PNAS Nexus,,2024,10.1093/pnasnexus/pgae346,https://doi.org/10.1093/pnasnexus/pgae346,OPENALEX,,
https://openalex.org/W4319793767,GPTScore: Evaluate as You Desire,Jinlan Fu;See-Kiong Ng;Zhengbao Jiang;Pengfei Liu,Abstract available,,arXiv (Cornell University),,2023,10.48550/arxiv.2302.04166,https://arxiv.org/abs/2302.04166,OPENALEX,,
https://openalex.org/W4360976356,Physics guided deep learning for generative design of crystal materials with symmetry constraints,Yong Zhao;Edirisuriya M. Dilanga Siriwardane;Zhenyao Wu;Nihang Fu;Mohammed Al?Fahdi;Ming Hu;Jianjun Hu,Abstract available,,npj Computational Materials,,2023,10.1038/s41524-023-00987-9,https://www.nature.com/articles/s41524-023-00987-9.pdf,OPENALEX,,
https://openalex.org/W4404239715,Large language models for generative information extraction: a survey,Derong Xu;Wei Chen;Wenjun Peng;Chao Zhang;Tong Xu;Xiangyu Zhao;Xian Wu;Yefeng Zheng;Yan Wang;Enhong Chen,Abstract available,,Frontiers of Computer Science,,2024,10.1007/s11704-024-40555-y,https://doi.org/10.1007/s11704-024-40555-y,OPENALEX,,
